{
  "version": "employee_mission_queue_v1",
  "generated_at": "2026-07-09T00:00:00+01:00",
  "source_task_center": "apps/commander/product_knowledge_gap_task_center/hk620_product_knowledge_gap_tasks.v1.json",
  "queue_status_enum": [
    "queued",
    "in_progress",
    "blocked",
    "qa_pending",
    "completed",
    "failed"
  ],
  "employees": {
    "website_agent": {
      "employee_id": "website_agent",
      "employee_name": "Website Agent",
      "queue_count": 2,
      "queued_count": 2,
      "qa_pending_count": 0,
      "blocked_public_publish_count": 0,
      "current_task": "完成 HK620 缺口任务：外部参考链接。确认 HK620 官方产品页、公开资料页或可引用外部链接。",
      "queue_items": [
        {
          "queue_item_id": "queue_website_agent_hk620_gap_005_external_references",
          "mission_id": "mission_hk620_gap_005_external_references",
          "source_gap_id": "hk620_gap_005_external_references",
          "assigned_agent": "Website Agent",
          "priority": "P2",
          "status": "queued",
          "expected_output": "完成 HK620 缺口任务：外部参考链接。确认 HK620 官方产品页、公开资料页或可引用外部链接。",
          "acceptance_criteria": "至少 1 个官方或可信外部链接；URL 可访问状态由人工或后续授权工具确认；不得引用未审核页面。",
          "depends_on": [],
          "blocks_public_publish": false,
          "created_at": "2026-07-09T00:00:00+01:00",
          "updated_at": "2026-07-09T00:00:00+01:00"
        },
        {
          "queue_item_id": "queue_website_agent_hk620_gap_006_internal_links",
          "mission_id": "mission_hk620_gap_006_internal_links",
          "source_gap_id": "hk620_gap_006_internal_links",
          "assigned_agent": "Website Agent",
          "priority": "P2",
          "status": "queued",
          "expected_output": "完成 HK620 缺口任务：内部链接。建立 HK620 相关内部链接目标，例如产品页、骨骼门知识页、封边机分类页、Factory Solution 页面。",
          "acceptance_criteria": "至少 3 个内部链接目标；每个目标有标题、路径、锚文本建议；QA Agent 检查不重复、不误导。",
          "depends_on": [],
          "blocks_public_publish": false,
          "created_at": "2026-07-09T00:00:00+01:00",
          "updated_at": "2026-07-09T00:00:00+01:00"
        }
      ]
    },
    "knowledge_agent": {
      "employee_id": "knowledge_agent",
      "employee_name": "Knowledge Agent",
      "queue_count": 6,
      "queued_count": 6,
      "qa_pending_count": 0,
      "blocked_public_publish_count": 6,
      "current_task": "完成 HK620 缺口任务：公开技术规格。补齐可公开使用的 HK620 技术规格，包括 power、voltage、machine_size、weight、processing_speed、edge_band_thickness、workpiece_size_range、control_system、glue_system、cutting_system、grooving_system、air_pressure、packing_size。",
      "queue_items": [
        {
          "queue_item_id": "queue_knowledge_agent_hk620_gap_001_public_technical_specs",
          "mission_id": "mission_hk620_gap_001_public_technical_specs",
          "source_gap_id": "hk620_gap_001_public_technical_specs",
          "assigned_agent": "Knowledge Agent",
          "priority": "P0",
          "status": "queued",
          "expected_output": "完成 HK620 缺口任务：公开技术规格。补齐可公开使用的 HK620 技术规格，包括 power、voltage、machine_size、weight、processing_speed、edge_band_thickness、workpiece_size_range、control_system、glue_system、cutting_system、grooving_system、air_pressure、packing_size。",
          "acceptance_criteria": "形成可引用规格表；每个参数有来源文件或审核人；标明 public_use_allowed=true；QA Agent 验收无矛盾。",
          "depends_on": [],
          "blocks_public_publish": true,
          "created_at": "2026-07-09T00:00:00+01:00",
          "updated_at": "2026-07-09T00:00:00+01:00"
        },
        {
          "queue_item_id": "queue_knowledge_agent_hk620_gap_002_product_images",
          "mission_id": "mission_hk620_gap_002_product_images",
          "source_gap_id": "hk620_gap_002_product_images",
          "assigned_agent": "Knowledge Agent",
          "priority": "P1",
          "status": "queued",
          "expected_output": "完成 HK620 缺口任务：产品图片。补齐 HK620 产品主图、细节图、应用图，并确认可用于网站草稿和公开页面。",
          "acceptance_criteria": "至少 1 张主图、2 张细节图、1 张应用图；有文件路径、版权/使用许可、Alt 建议；QA Agent 确认可用。",
          "depends_on": [],
          "blocks_public_publish": true,
          "created_at": "2026-07-09T00:00:00+01:00",
          "updated_at": "2026-07-09T00:00:00+01:00"
        },
        {
          "queue_item_id": "queue_knowledge_agent_hk620_gap_003_product_videos",
          "mission_id": "mission_hk620_gap_003_product_videos",
          "source_gap_id": "hk620_gap_003_product_videos",
          "assigned_agent": "Knowledge Agent",
          "priority": "P1",
          "status": "queued",
          "expected_output": "完成 HK620 缺口任务：产品视频。补齐 HK620 demo 视频、工厂操作视频或短视频素材，不能虚构视频证据。",
          "acceptance_criteria": "至少 1 条 demo 或操作视频；有来源、使用边界、关键画面说明；QA Agent 确认不含未审客户/敏感信息。",
          "depends_on": [],
          "blocks_public_publish": true,
          "created_at": "2026-07-09T00:00:00+01:00",
          "updated_at": "2026-07-09T00:00:00+01:00"
        },
        {
          "queue_item_id": "queue_knowledge_agent_hk620_gap_004_customer_cases",
          "mission_id": "mission_hk620_gap_004_customer_cases",
          "source_gap_id": "hk620_gap_004_customer_cases",
          "assigned_agent": "Knowledge Agent",
          "priority": "P1",
          "status": "queued",
          "expected_output": "完成 HK620 缺口任务：客户案例。补齐可公开或可匿名使用的客户案例、应用场景或验收故事。",
          "acceptance_criteria": "至少 1 个可公开或匿名案例；包含行业、应用、问题、解决方向；不得包含未经授权客户名称；QA Agent 验收。",
          "depends_on": [],
          "blocks_public_publish": true,
          "created_at": "2026-07-09T00:00:00+01:00",
          "updated_at": "2026-07-09T00:00:00+01:00"
        },
        {
          "queue_item_id": "queue_knowledge_agent_hk620_gap_007_service_faq",
          "mission_id": "mission_hk620_gap_007_service_faq",
          "source_gap_id": "hk620_gap_007_service_faq",
          "assigned_agent": "Knowledge Agent",
          "priority": "P1",
          "status": "queued",
          "expected_output": "完成 HK620 缺口任务：服务 FAQ。补齐 HK620 安装、维护、常见问题、故障排除和使用边界。",
          "acceptance_criteria": "至少 8 条服务 FAQ；包含问题、回答、适用条件、禁止承诺；QA Agent 确认不虚构保修或技术承诺。",
          "depends_on": [],
          "blocks_public_publish": true,
          "created_at": "2026-07-09T00:00:00+01:00",
          "updated_at": "2026-07-09T00:00:00+01:00"
        },
        {
          "queue_item_id": "queue_knowledge_agent_hk620_gap_008_delivery_warranty_price_policy",
          "mission_id": "mission_hk620_gap_008_delivery_warranty_price_policy",
          "source_gap_id": "hk620_gap_008_delivery_warranty_price_policy",
          "assigned_agent": "Knowledge Agent",
          "priority": "P1",
          "status": "queued",
          "expected_output": "完成 HK620 缺口任务：交付/保修/价格政策。明确 HK620 交付周期、保修范围、报价表达边界和价格政策。",
          "acceptance_criteria": "形成可公开表达和不可公开表达两类话术；价格/ROI/利润不得虚构；QA Agent 验收。",
          "depends_on": [],
          "blocks_public_publish": true,
          "created_at": "2026-07-09T00:00:00+01:00",
          "updated_at": "2026-07-09T00:00:00+01:00"
        }
      ]
    },
    "qa_agent": {
      "employee_id": "qa_agent",
      "employee_name": "QA Agent",
      "queue_count": 10,
      "queued_count": 2,
      "qa_pending_count": 8,
      "blocked_public_publish_count": 8,
      "current_task": "验收 HK620 缺口任务：公开技术规格，确认 QA Score、公开边界和是否仍阻断发布。",
      "queue_items": [
        {
          "queue_item_id": "queue_qa_agent_validate_hk620_gap_001_public_technical_specs",
          "mission_id": "mission_validate_hk620_gap_001_public_technical_specs",
          "source_gap_id": "hk620_gap_001_public_technical_specs",
          "assigned_agent": "QA Agent",
          "priority": "P0",
          "status": "qa_pending",
          "expected_output": "验收 HK620 缺口任务：公开技术规格，确认 QA Score、公开边界和是否仍阻断发布。",
          "acceptance_criteria": "先等待 Knowledge Agent 输出；随后按标准验收：形成可引用规格表；每个参数有来源文件或审核人；标明 public_use_allowed=true；QA Agent 验收无矛盾。",
          "depends_on": [
            "mission_hk620_gap_001_public_technical_specs"
          ],
          "blocks_public_publish": true,
          "created_at": "2026-07-09T00:00:00+01:00",
          "updated_at": "2026-07-09T00:00:00+01:00"
        },
        {
          "queue_item_id": "queue_qa_agent_validate_hk620_gap_002_product_images",
          "mission_id": "mission_validate_hk620_gap_002_product_images",
          "source_gap_id": "hk620_gap_002_product_images",
          "assigned_agent": "QA Agent",
          "priority": "P1",
          "status": "qa_pending",
          "expected_output": "验收 HK620 缺口任务：产品图片，确认 QA Score、公开边界和是否仍阻断发布。",
          "acceptance_criteria": "先等待 Knowledge Agent 输出；随后按标准验收：至少 1 张主图、2 张细节图、1 张应用图；有文件路径、版权/使用许可、Alt 建议；QA Agent 确认可用。",
          "depends_on": [
            "mission_hk620_gap_002_product_images"
          ],
          "blocks_public_publish": true,
          "created_at": "2026-07-09T00:00:00+01:00",
          "updated_at": "2026-07-09T00:00:00+01:00"
        },
        {
          "queue_item_id": "queue_qa_agent_validate_hk620_gap_003_product_videos",
          "mission_id": "mission_validate_hk620_gap_003_product_videos",
          "source_gap_id": "hk620_gap_003_product_videos",
          "assigned_agent": "QA Agent",
          "priority": "P1",
          "status": "qa_pending",
          "expected_output": "验收 HK620 缺口任务：产品视频，确认 QA Score、公开边界和是否仍阻断发布。",
          "acceptance_criteria": "先等待 Knowledge Agent 输出；随后按标准验收：至少 1 条 demo 或操作视频；有来源、使用边界、关键画面说明；QA Agent 确认不含未审客户/敏感信息。",
          "depends_on": [
            "mission_hk620_gap_003_product_videos"
          ],
          "blocks_public_publish": true,
          "created_at": "2026-07-09T00:00:00+01:00",
          "updated_at": "2026-07-09T00:00:00+01:00"
        },
        {
          "queue_item_id": "queue_qa_agent_validate_hk620_gap_004_customer_cases",
          "mission_id": "mission_validate_hk620_gap_004_customer_cases",
          "source_gap_id": "hk620_gap_004_customer_cases",
          "assigned_agent": "QA Agent",
          "priority": "P1",
          "status": "qa_pending",
          "expected_output": "验收 HK620 缺口任务：客户案例，确认 QA Score、公开边界和是否仍阻断发布。",